{
  "schema_version": "1.0-candidate",
  "checkpoint_id": "LCP-0111-PREREG-DRAFT-001",
  "candidate_version": "0.11.1",
  "parent_version": "0.10",
  "release_state": "PREREGISTRATION_DRAFT",
  "immutable_boundary": {
    "registry_id": "IMMUT-0111-DRAFT-001",
    "historical_versions": [
      "0.11",
      "0.10",
      "0.09.2",
      "0.09",
      "0.09.1",
      "0.08",
      "0.07",
      "0.06.1",
      "0.06",
      "0.05",
      "0.04",
      "0.03",
      "0.02",
      "0.01"
    ],
    "hash_algorithm": "sha256",
    "mutation_rule": "v0.10 and earlier protected bytes plus all 154 failed-v0.11 baseline bytes are immutable; only reserved v0.11.1 retry namespaces may change before freeze.",
    "registry_ref": "versions/v0.11.1/IMMUTABILITY-BOUNDARY-DRAFT.json"
  },
  "validation_profile": {
    "profile_id": "VAL-0111-PREREG-DRAFT-001",
    "commands": [
      "python -m pytest -q",
      "PYTHONPATH=src python -m spec_creator.cli validate . --no-package-manifest",
      "python versions/v0.11.1/tools/preregistration_preflight.py"
    ],
    "success_condition": "155/155 inherited parent tests pass; workspace validation has zero errors/warnings; v0.10 is 1120/1120 hash-intact; failed-v0.11 baseline is 154/154 hash-intact; inherited 24 regressions plus REG-0025 are exact; current package classification and all prospective output paths have zero classification errors; and all 16 retry metrics remain preregistered without weakening the original 15 v0.11 targets."
  },
  "blockers": [
    {
      "blocker_id": "B-0111-INDEPENDENT-PREFREEZE-REVIEW",
      "status": "OPEN",
      "description": "A genuinely separate receiving context must independently review the v0.11.1 retry preregistration and REG-0025 prospective ownership closure before freeze.",
      "owner_decision_required": false,
      "transition_token": "independent_prefreeze_review_required"
    },
    {
      "blocker_id": "B-0111-FROZEN-HASHES",
      "status": "OPEN",
      "description": "Final reviewed artifact hashes and retry frozen release contract do not yet exist.",
      "owner_decision_required": false,
      "transition_token": "frozen_hashes_not_established"
    }
  ],
  "next_legal_action": {
    "action_id": "ACT-0111-INDEPENDENT-PREFREEZE-001",
    "description": "Perform one genuinely separate independent prefreeze review of the v0.11.1 retry candidate. Recompute current whole-package classification, prospective output closure, failed-v0.11 baseline integrity, target nonweakening, schemas/oracles/fixtures/universes, parent suite, and regression universe. Return raw evidence and freeze-readiness recommendation; do not implement or freeze.",
    "allowed_actor": "genuinely separate receiving context that did not create the v0.11.1 retry candidate",
    "required_inputs": [
      "versions/v0.11.1/SPEC-CREATOR-v0.11.1.md",
      "versions/v0.11.1/EVALUATION-DESIGN.json",
      "versions/v0.11.1/EVALUATION-UNIVERSES.json",
      "versions/v0.11.1/EVALUATION-PLAN.json",
      "versions/v0.11.1/IMMUTABILITY-BOUNDARY-DRAFT.json",
      "versions/v0.11.1/SUCCESSOR-OWNERSHIP-UNIVERSE.json",
      "versions/v0.11.1/FAILED-PREDECESSOR-v0.11-BASELINE.json",
      "versions/v0.11.1/ACTIVE-REGRESSION-UNIVERSE.json",
      "versions/v0.11.1/PARENT-SUITE-UNIVERSE.json",
      "versions/v0.11.1/candidate-schemas/",
      "versions/v0.11.1/candidate-fixtures/",
      "versions/v0.11.1/LIFECYCLE-TRANSITION-RULES.candidate.json",
      "versions/v0.11.1/DEPENDENCY-PROVENANCE-RULES.candidate.json",
      "versions/v0.11.1/PREREGISTRATION-ARTIFACT-HASHES-DRAFT.json"
    ],
    "expected_outputs": [
      "independent REG-0025 verdict",
      "exact current package classification counts and any errors",
      "prospective output closure verdict",
      "154/154 failed-v0.11 baseline hash recomputation",
      "1120/1120 v0.10 hash recomputation",
      "15 inherited metric nonweakening comparison plus additive retry guardrail",
      "schema/oracle/fixture/universe audit",
      "clean-extraction validation evidence",
      "READY_FOR_FREEZE_PREPARATION or NOT_READY with defects"
    ],
    "action_token": "independent_prefreeze_review"
  },
  "required_artifacts": [
    "versions/v0.11.1/DEC-0034.json",
    "versions/v0.11.1/DEFECT-RESOLUTION-POSTFREEZE-001.json",
    "versions/v0.11.1/FAILED-PREDECESSOR-v0.11-BASELINE.json",
    "versions/v0.11.1/SPEC-CREATOR-v0.11.1.md",
    "versions/v0.11.1/EVALUATION-DESIGN.json",
    "versions/v0.11.1/EVALUATION-UNIVERSES.json",
    "versions/v0.11.1/EVALUATION-PLAN.json",
    "versions/v0.11.1/IMMUTABILITY-BOUNDARY-DRAFT.json",
    "versions/v0.11.1/SUCCESSOR-OWNERSHIP-UNIVERSE.json",
    "versions/v0.11.1/PARENT-SUITE-UNIVERSE.json",
    "versions/v0.11.1/ACTIVE-REGRESSION-UNIVERSE.json",
    "versions/v0.11.1/candidate-fixtures/ownership-prospective-paths.json",
    "versions/v0.11.1/PREREGISTRATION-ARTIFACT-HASHES-DRAFT.json",
    "versions/v0.11.1/INDEPENDENT-PREFREEZE-REVIEW-PROTOCOL.md",
    "versions/v0.11.1/INDEPENDENT-PREFREEZE-REVIEW-PROMPT.md"
  ],
  "stop_condition": "Do not freeze or implement v0.11.1 in the context that created this retry preregistration. Stop only after local preflight is clean and an independent-review checkpoint is sealed.",
  "notes": [
    "v0.11 failed frozen state remains immutable evidence; no frozen v0.11 artifact is rewritten.",
    "v0.10 remains executable promoted authority until v0.11.1 independently verifies and promotes.",
    "REG-0025 prospectively validates every known output family rather than merely the 52 observed missing freeze paths.",
    "ESIS Top-5 Repository Prototype Synthesis remains forward product direction, outside v0.11.1 promotion metrics."
  ],
  "transition_rule_ref": "versions/v0.11.1/LIFECYCLE-TRANSITION-RULES.candidate.json"
}
